{
  "irVersion":"1.0",
  "game":{"id":"bobos-rainbow","title":"Bobo's Rainbow","description":"Collect hearts and complete the rainbow.","entryScene":"rainbow-field","orientation":"portrait","sessionTargetSeconds":90,"audience":"family"},
  "assets":[],
  "scenes":[{"id":"rainbow-field","entities":[
    {"id":"player","kind":"player","position":[195,650],"size":[72,88],"components":["movement","collider","score"]},
    {"id":"kitten","kind":"decoration","position":[320,650],"size":[64,64],"components":[]},
    {"id":"heart","kind":"pickup","position":[195,280],"size":[36,36],"components":["collider","collectible"]}
  ]}],
  "inputBindings":[{"action":"move","input":"drag"}],
  "rules":[
    {"id":"heart-caught","when":{"event":"collected","source":"player","target":"heart"},"actions":[{"type":"add_score","target":"player","value":1},{"type":"destroy_entity","target":"heart"},{"type":"show_text","value":"You caught a heart!"}]},
    {"id":"rainbow-complete","when":{"event":"score_reached","source":"player","value":12},"actions":[{"type":"show_text","value":"The rainbow is complete!"},{"type":"end_game","value":true}]}
  ],
  "metadata":{"tags":["family","collecting","defold-fixture"]}
}
